Text,Number of Tokens,Rating,Gan's Rating,Yimin's Rating
"Q: Is it true that there are two kinds of people serving as deputies of the Supreme Soviet of the USSR, as members of the Supreme Court, and as Soviet diplomats? A: Yes, it is true. One kind is those not capable of anything at all, and the other is those capable of anything whatsoever.",64,5,4,5
"Q: Why do we need two central newspapers, Pravda (Truth) and Izvestiya (News) if both are organs of the same Party? A: Because in Pravda there is no news, and in Izvestiya there is no truth.",54,5,5,4
"Q: Is it true that every Soviet soldier dreams of becoming a general? A: No, our soldiers are not that stupid. They know that generals may become MIA even in time of peace.",40,5,4,5
"Q: What is the difference between the Constitutions of the USA and USSR? Both guarantee freedom of speech. A: Yes, and the US Constitution also guarantees freedom after speech.",36,5,5,4
"Q: Can a son of a General become a Marshal? A: No, because every Marshal also has a son.",24,5,5,5
"Q: What is permitted and what is prohibited? A: In England, what is permitted, is permitted, and what is prohibited, is prohibited. In America everything is permitted except for what is prohibited. In Germany everything is prohibited except for what is permitted. In France everything is permitted, even what is prohibited. In the USSR everything is prohibited, even what is permitted.",75,4,5,2
"Q: Why do policemen always walk the streets in teams of three? A: The partners in the police team are always chosen in such a way that one of them knows how to read, the other how to write, and the third one, naturally, has to keep watch over those two intellectuals.",60,4,5,2
"Q: Why do some people say that Hungarians love the Russians and hate the Americans? A: Because Russians helped Hungarians to get rid of one totalitarian rule, but Americans didn't help to get rid of the other.",45,4,4,3
"Q: Is it true that American skyscrapers are the tallest in the world? A: Yes, it's true, but on the other hand the Soviet-made transistors are the largest in the world.",43,4,3,4
"Q: Could an atomic bomb destroy our beloved town, Yerevan, with its splendid buildings and beautiful gardens? A: In principle, yes. But Moscow is by far a more beautiful city.",40,4,5,3
Q: What to do if a man you don't know takes a seat at your table in a pub and starts to sigh? A: Immediately demand to stop the anti-Soviet propaganda.,39,4,4,4
"Q: Is it true that in the Soviet Union people do not need stereophonic equipment? A: In principle, yes. One hears exactly the same thing from all sides.",36,4,3,4
"Q: Will there be a third world war? A: No, but the struggle for peace will reach such a degree that there will be no stone left intact on the earth.",36,4,2,5
Q: What should we do if the Western borders of the USSR were opened? A: Rush to Siberia at once in order not to be crushed in the stampede.,35,4,5,3
"Q: Is there a problem of racism in the USSR? A: No. In our country, both the whites and the blacks are counted among the red.",32,4,3,4
Q: What do the leaders of the communist countries have in common with the unemployed in the West? A: They all are uncertain about their next day.,31,4,3,4
"Q: Is it possible to build socialism in one stand-alone country? A: It's possible, but better to live in another country.",28,4,4,4
"Q: What is the easiest way to explain the meaning of the word ""communism?"" A: By means of fists.",26,4,5,2
Q: What is a Soviet musical duet? A: It's a musical quartet after a trip abroad.,23,4,5,2
Q: What is it that starts with an R and never ends? A: Reorganization.,19,4,3,5
Q: What is chaos? A: We do not comment on national economics.,16,4,3,4
"Q: Can a woman serve as a diplomat? A: No, because a woman and a diplomat use differently the words Yes and No. If a diplomat says Yes, it means Maybe. If a diplomat says Maybe, it means No. If a diplomat says No, what kind of diplomat is he? On the other hand, if a woman says No, it means Maybe. If a woman says Maybe, it means Yes. If a woman says Yes, well, what kind of woman is she?",101,3,2,3
"Q: Is it true that there is freedom of speech in the Soviet Union the same as there is the USA? A: In principle, yes. In the USA, you can stand in front of the Washington Monument in Washington, DC, and yell, ""Down with Reagan!"", and you will not be punished. In the Soviet Union, you can stand in the Red Square in Moscow and yell, ""Down with Reagan!"", and you will not be punished.",92,3,4,2
"Q: Does China have rockets powerful enough to reach the moon? A: They don't need rockets. If the Chinese communist Party ordered, their people just would step on each other's shoulders, and this way they could reach even the sun.",49,3,3,2
"Q: Is it true that the poet Vladimir Mayakovsky committed suicide? A: Yes, it is true, and even the record of his very last words is preserved: ""Don't shoot, comrades.""",42,3,3,2
Q: What will be the results of the next elections? A: Nobody can tell. Somebody stole yesterday the exact results of the next elections from the office of the Central Committee of the USSR.,39,3,3,3
"Q: When communism will be built, will there still be Jews and Armenians? A: Don't worry, the Jews and the Armenians will find a way to fink out.",38,3,2,4
"Q: Is it possible to open a brothel in Erevan? A: It's possible, only in the socialist society we don't say brothel. We call it collective.",38,3,3,2
"Q: Are there questions you can't answer? A: No. We approach our job in accordance with the Marx' dialectics. To any question, we can give any answer.",37,3,2,3
"Q: What is the difference between the capitalist advertising and the communist propaganda? A: We don't know about the difference, but one can't get away from either of them.",36,3,1,4
"Q: What is the duration of the workday in a socialist country? A: Of course, it's an eight-hour workday: from eight am to eight pm.",35,3,4,2
"Q: Is it possible for a man to give birth? A: There has not been such a case on record, but experiments continue in many countries.",31,3,3,2
"Q: Which tea is better, Chinese or Soviet-grown? A: Don't mix up in the confrontation between the superpowers. Drink coffee.",30,3,2,4
"Q: Why Lenin wore regular shoes, but Stalin wore boots? A: At Lenin's time, Russia was still only ankle-high in shit.",29,3,4,2
"Q: Will everybody learn swimming when communism is built? A: Please, please... Don't compare communism to the World Flood.",26,3,3,2
"Q: Is there in the USSR an open opposition? A: Even if it were, it would long have been none.",25,3,1,5
Q: Why the answers of Armenian Radio are often stupid? A: Because these answers are invented not by Armenians.,24,3,2,3
Q: Why is there no flour in the market? A: Because they began adding it to the bread.,22,3,3,3
"Q: Will people have money when communism is built? A: Some will, some will not.",20,3,2,3
"Q: How to prevent damage caused by earthquakes? A: To borrow the experience of the progressive part of the Western youth. They often organize mass demonstrations, for a cause or without a cause, under a universal slogan, ""We protest!"" With this slogan, they bravely march in front of parliaments, or of Universities, or of any other structures. As a rule, they carry portraits of Marx, Lenin, Che Guevara, Tito, Mao, Stalin, Hitler, Ho Chi Min, Charlie Chaplin, Arafat, Napoleon, The Pope, Nelson Mandela, Michael Jackson, Madonna, and many other known and unknown personalities. The oscillations of the ground caused by their footsteps strengthen the urban structures.",147,2,1,2
Q: We are told that the communism is already seen at the horizon. What then is a horizon? A: Horizon is an imaginary line which moves away each time you approach it.,37,2,3,1
"Q: What is communism? A: It's when everything will be available in stores. In other words, like it was under the Czar Nikolai the Second.",34,2,3,1
"Q: What methods do our enemies use in their subversive work against the socialist state? A: Such questions we discuss in our program ""Useful Advice.""",33,2,3,1
Q: Why did butter disappear from the stores' shelves? A: It all has melted under the sun of the Soviet Constitution.,26,2,3,1
Q: Is there anti-Semitism in the USSR? A: We must answer in the positive: No!,21,2,1,3
"Q: May you please give an example of the greatest utterances by Stalin? A: Yes. For example, Stalin taught, ""One has to plan skillfully. One should not plan unskillfully. What does it mean? It means that we, the communists, must not plan unskillfully. If we plan unskillfully then we plan poorly. And if we plan skillfully, then we'll plan well!"" That's what the Great Stalin taught us.",96,1,1,1
